{
  "generatedAt": "2026-10-06T07:23:43.559Z",
  "baselineId": "baseline-2026-10-05",
  "baselinePath": "tests/data/baselines/baseline-2026-10-05",
  "product": "Elite Access II",
  "jurisdiction": "Colorado",
  "caseName": "Boun",
  "summary": {
    "total": 4,
    "expected": 0,
    "unexpected": 2,
    "info": 2
  },
  "changes": [
    {
      "changeId": "CHG-001",
      "page": "new-application-information",
      "fieldOrLocator": "new-application-information#dom",
      "changeType": "dom-changed",
      "severity": "low",
      "classification": "info",
      "matchedTicketId": null,
      "description": "Page markup changed with no field inventory diff (4e692e1e → aecf86df). Recapture baseline after HITL; do not patch locators from the hash.",
      "baselineValue": "4e692e1e2ed10fc784d7247691cf4977fb4d00bed43c2de47c4997b9656f9836",
      "currentValue": "aecf86df9a8254b82f68d513326fcb88d34303ff67eea061141b099f85c42c69",
      "evidenceScreenshot": "tests/reports/changes/evidence/new-application-information.png",
      "requiresHumanAcceptance": true,
      "acceptanceStatus": "pending",
      "healAction": "recapture-baseline"
    },
    {
      "changeId": "CHG-002",
      "page": "owner",
      "fieldOrLocator": "Are you an active military member?",
      "changeType": "label-changed",
      "severity": "medium",
      "classification": "unexpected",
      "matchedTicketId": null,
      "description": "Element changed on owner: Active_Military_Question Detect walk also missed the old locator (Are you an active military member?); that is the same change, not a second defect.",
      "baselineValue": "{\"tag\":\"div\",\"label\":\"Are you an active military member?\",\"type\":null,\"text\":\"Are you an active military member?\"}",
      "currentValue": "{\"tag\":\"div\",\"label\":\"Is this client an active military member?\",\"type\":null,\"text\":\"Is this client an active military member?\"}",
      "evidenceScreenshot": "tests/reports/changes/evidence/owner.png",
      "requiresHumanAcceptance": true,
      "acceptanceStatus": "pending",
      "healAction": "file-defect"
    },
    {
      "changeId": "CHG-003",
      "page": "signing-process",
      "fieldOrLocator": "Wet Signature",
      "changeType": "label-changed",
      "severity": "medium",
      "classification": "unexpected",
      "matchedTicketId": null,
      "description": "Element changed on signing-process: Esign_YesNo Detect walk also missed the old locator (locator.waitFor: Timeout 20000ms exceeded.\nCall log:\n  - waiting for getByRole('checkbox', { name: 'Wet Signature', exac); that is the same change, not a second defect.",
      "baselineValue": "{\"tag\":\"div\",\"label\":\"Wet Signature\",\"type\":\"checkbox\",\"text\":\"\"}",
      "currentValue": "{\"tag\":\"div\",\"label\":\"E-signature\",\"type\":\"checkbox\",\"text\":\"\"}",
      "evidenceScreenshot": "tests/reports/changes/evidence/signing-process.png",
      "requiresHumanAcceptance": true,
      "acceptanceStatus": "pending",
      "healAction": "file-defect"
    },
    {
      "changeId": "CHG-004",
      "page": "signing-process",
      "fieldOrLocator": "Which method will be used to collect signatures?",
      "changeType": "modified",
      "severity": "low",
      "classification": "info",
      "matchedTicketId": null,
      "description": "Inventory node Sign_Method_Text is gone, but the same wording is still in the live page markup (not a missing field).",
      "baselineValue": "{\"tag\":\"div\",\"label\":\"Which method will be used to collect signatures?\",\"type\":null,\"text\":\"Which method will be used to collect signatures?\"}",
      "currentValue": null,
      "evidenceScreenshot": "tests/reports/changes/evidence/signing-process.png",
      "requiresHumanAcceptance": true,
      "acceptanceStatus": "pending",
      "healAction": "recapture-baseline"
    }
  ]
}